{
  "$schema": "https://json-schema.org/draft/2020-12/schema",
  "title": "x402 public catalog provider",
  "type": "object",
  "additionalProperties": false,
  "required": ["version", "fqn", "title", "subtitle", "description", "useCase", "i18n", "logo", "category", "chains", "isFirstParty", "isFeatured", "featuredTags", "serviceUrl", "endpoints"],
  "properties": {
    "version": { "const": 1 },
    "fqn": { "type": "string", "pattern": "^[a-z0-9][a-z0-9-]{1,62}$" },
    "title": { "$ref": "#/$defs/text" },
    "mainTitle": { "$ref": "#/$defs/text" },
    "subtitle": { "$ref": "#/$defs/text" },
    "description": { "$ref": "#/$defs/text" },
    "useCase": { "$ref": "#/$defs/text" },
    "i18n": { "$ref": "#/$defs/i18n" },
    "logo": { "$ref": "#/$defs/text" },
    "category": { "enum": ["ai_ml", "cloud", "compute", "data", "devtools", "finance", "identity", "media", "messaging", "other", "productivity", "search", "security", "shopping", "storage", "translation"] },
    "chains": { "type": "array", "items": { "$ref": "#/$defs/network" }, "minItems": 1, "uniqueItems": true },
    "isFirstParty": { "type": "boolean" },
    "isFeatured": { "type": "boolean" },
    "featuredTags": { "type": "array", "items": { "type": "string" }, "uniqueItems": true },
    "serviceUrl": { "$ref": "#/$defs/httpsUrl" },
    "endpoints": { "type": "array", "minItems": 1, "items": { "$ref": "#/$defs/endpoint" } },
    "status": { "$ref": "#/$defs/status" }
  },
  "$defs": {
    "text": { "type": "string", "minLength": 1 },
    "httpsUrl": { "type": "string", "pattern": "^https://" },
    "localized": {
      "type": "object",
      "additionalProperties": false,
      "required": ["title", "subtitle", "description", "useCase"],
      "properties": {
        "title": { "$ref": "#/$defs/text" },
        "mainTitle": { "$ref": "#/$defs/text" },
        "subtitle": { "$ref": "#/$defs/text" },
        "description": { "$ref": "#/$defs/text" },
        "useCase": { "$ref": "#/$defs/text" }
      }
    },
    "i18n": {
      "type": "object",
      "required": ["zh-CN"],
      "properties": { "zh-CN": { "$ref": "#/$defs/localized" } },
      "additionalProperties": { "$ref": "#/$defs/localized" }
    },
    "network": {
      "type": "string",
      "minLength": 1,
      "allOf": [{ "if": { "pattern": "^tron:" }, "then": { "enum": ["tron:728126428", "tron:3448148188", "tron:2494104990"] } }]
    },
    "status": {
      "type": "object",
      "additionalProperties": false,
      "required": ["catalog", "gateway", "payment", "upstream"],
      "properties": {
        "catalog": { "enum": ["listed", "unlisted"] },
        "gateway": { "enum": ["configured", "unknown", "unavailable"] },
        "payment": { "enum": ["paid-route", "mainnet", "testnet", "unknown"] },
        "upstream": { "enum": ["public", "authenticated", "unknown", "unavailable"] }
      }
    },
    "endpoint": {
      "type": "object",
      "additionalProperties": false,
      "required": ["method", "path", "url", "title", "subtitle", "description", "useCase", "i18n", "metered", "minPriceUsd", "maxPriceUsd"],
      "properties": {
        "method": { "type": "string", "pattern": "^[A-Z]+$" },
        "path": { "type": "string", "pattern": "^/" },
        "url": { "$ref": "#/$defs/httpsUrl" },
        "title": { "$ref": "#/$defs/text" },
        "subtitle": { "$ref": "#/$defs/text" },
        "description": { "$ref": "#/$defs/text" },
        "useCase": { "$ref": "#/$defs/text" },
        "i18n": { "$ref": "#/$defs/i18n" },
        "metered": { "type": "boolean" },
        "minPriceUsd": { "type": "number", "minimum": 0 },
        "maxPriceUsd": { "type": "number", "minimum": 0 },
        "x402Routes": { "type": "array", "minItems": 1, "items": { "$ref": "#/$defs/x402Route" } }
      }
    },
    "x402Route": {
      "type": "object",
      "additionalProperties": false,
      "required": ["provider", "network", "scheme", "url"],
      "properties": {
        "provider": { "$ref": "#/$defs/text" },
        "network": { "$ref": "#/$defs/network" },
        "scheme": { "enum": ["exact", "exact_gasfree"] },
        "assetTransferMethod": { "enum": ["eip3009", "permit2"] },
        "url": { "$ref": "#/$defs/httpsUrl" }
      },
      "allOf": [
        { "if": { "properties": { "scheme": { "const": "exact" } }, "required": ["scheme"] }, "then": { "required": ["assetTransferMethod"] } },
        { "if": { "properties": { "scheme": { "const": "exact_gasfree" } }, "required": ["scheme"] }, "then": { "properties": { "network": { "pattern": "^tron:" } }, "not": { "required": ["assetTransferMethod"] } } }
      ]
    }
  }
}
