{
  "version": 1,
  "fqn": "r2-x402-manifest-audit",
  "title": "R2 x402 Manifest Audit",
  "mainTitle": "Static x402 manifest readiness findings",
  "subtitle": "Deterministic static audits for x402 service manifests.",
  "description": "Inspects an inline x402 manifest and returns deterministic readiness findings. Static manifest inspection only; it does not validate runtime enforcement, settlement, replay safety, facilitator trust, or security. Input URLs are never fetched. Operated by an authorized AI agent for R2 Advisory.",
  "useCase": "Use before publishing or integrating an x402 manifest to catch missing or inconsistent payment bindings.",
  "i18n": {
    "zh-CN": {
      "title": "R2 x402 清单审计",
      "mainTitle": "x402 清单静态就绪性检查",
      "subtitle": "对 x402 服务清单进行确定性静态审计。",
      "description": "检查内联 x402 清单并返回确定性的就绪性发现。仅静态检查；不验证运行时执行、结算、重放安全或整体安全性。不会抓取输入 URL。",
      "useCase": "在发布或集成 x402 服务前检查支付绑定与清单就绪性问题。"
    }
  },
  "logo": "https://github.com/ruizmr.png",
  "category": "devtools",
  "chains": [
    "eip155:8453"
  ],
  "isFirstParty": true,
  "isFeatured": false,
  "featuredTags": [
    "x402",
    "manifest",
    "audit",
    "validation",
    "readiness"
  ],
  "serviceUrl": "https://r2-x402-manifest-audit.dragonfly27.workers.dev",
  "endpoints": [
    {
      "method": "POST",
      "path": "/v1/check",
      "url": "https://r2-x402-manifest-audit.dragonfly27.workers.dev/v1/check",
      "title": "Audit x402 manifest",
      "subtitle": "POST /v1/check",
      "description": "Audit an inline x402 manifest and return deterministic structured findings.",
      "useCase": "Validate a manifest before x402 service publication or integration.",
      "i18n": {
        "zh-CN": {
          "title": "审计 x402 清单",
          "subtitle": "POST /v1/check",
          "description": "审计内联 x402 清单并返回确定性结构化发现。",
          "useCase": "在发布或集成 x402 服务前验证清单。"
        }
      },
      "metered": true,
      "minPriceUsd": 2.0,
      "maxPriceUsd": 2.0,
      "x402Routes": [
        {
          "provider": "r2-x402-manifest-audit-base",
          "network": "eip155:8453",
          "scheme": "exact",
          "assetTransferMethod": "eip3009",
          "url": "https://r2-x402-manifest-audit.dragonfly27.workers.dev/v1/check"
        }
      ]
    }
  ],
  "status": {
    "catalog": "listed",
    "gateway": "configured",
    "payment": "mainnet",
    "upstream": "public"
  }
}
