{
  "version": 1,
  "fqn": "dia",
  "title": "DIA",
  "mainTitle": "Decentralized multi-source oracle prices",
  "subtitle": "Verifiable reference prices for valuation, settlement and risk.",
  "description": "## What it does\n\nDIA oracle price feeds over x402: transparent, multi-source aggregated token quotations across 80+ CEX/DEX markets for 3,000+ assets, through one provider with TRON, BSC and Base Mainnet payment routes.\n\n\n## Best for\n\n- Agents needing verifiable reference prices for valuation or settlement.\n- Manipulation-resistant pricing as a risk or compliance check.\n- Cross-checking a venue spot price against an independent oracle.\n\n## Endpoints\n\n- `GET /v1/quotation/{symbol}` — Aggregated price quotation by asset symbol\n- `GET /v1/assetQuotation/{blockchain}/{address}` — Aggregated price quotation by blockchain + contract address\n\n## Code usage\n\nThese routes are x402-paid passthroughs. Use x402 payment for gateway access. TRON Mainnet supports `exact` + `permit2` and `exact_gasfree`; Permit2 is the default and `exact_gasfree` remains optional:\n\n```bash\ncurl -sS 'https://x402-gateway.bankofai.io/providers/dia-price-tron/v1/quotation/{symbol}'\n```\n\nPay on TRON Mainnet with the Wallet CLI (amount in the selected token):\n\n```bash\nwallet-cli x402 pay 'https://x402-gateway.bankofai.io/providers/dia-price-tron/v1/quotation/{symbol}' \\\n  --password-stdin \\\n  --method GET \\\n  --network tron:728126428 \\\n  --token USDT \\\n  --scheme exact \\\n  --max-amount 0.000001\n```\n\nBNB Smart Chain Mainnet (`eip155:56`, `exact` + `permit2`) example:\n\n```bash\ncurl -sS 'https://x402-gateway.bankofai.io/providers/dia-price-bsc/v1/quotation/{symbol}'\n```\n\nPay on BNB Smart Chain Mainnet with the Wallet CLI (amount in the selected token):\n\n```bash\nwallet-cli x402 pay 'https://x402-gateway.bankofai.io/providers/dia-price-bsc/v1/quotation/{symbol}' \\\n  --password-stdin \\\n  --method GET \\\n  --network eip155:56 \\\n  --token USDT \\\n  --scheme exact \\\n  --max-amount 0.000001\n```\n\n## Base Mainnet payment\n\nBase Mainnet routes use official USDC on `eip155:8453` with x402 `exact` and EIP-3009.",
  "useCase": "Use to get a real-time, multi-market aggregated USD price for a token by symbol or by blockchain+contract address.",
  "i18n": {
    "zh-CN": {
      "title": "DIA",
      "subtitle": "可验证的参考价,用于估值、结算与风控。",
      "description": "## 能做什么\n\nDIA 预言机价格的 x402 网关:跨 80+ CEX/DEX 市场、覆盖 3000+ 资产的透明多源聚合报价,一个 provider 覆盖 TRON、BSC 与 Base 主网。\n\n## 适合场景\n\n- 需要可验证参考价做估值或结算的 Agent。\n- 用抗操纵价格做风控/合规校验。\n- 与盘口现价交叉验证。\n\n## 接口\n\n- `GET /v1/quotation/{symbol}` — 按资产符号聚合的价格报价\n- `GET /v1/assetQuotation/{blockchain}/{address}` — 按链 + 合约地址聚合的价格报价\n\n## 调用示例\n\n这些是 x402 付费直通路由,通过 x402 支付后访问网关。TRON 主网同时支持 `exact` + `permit2` 和 `exact_gasfree`; 默认使用 Permit2，也可选择 `exact_gasfree`:\n\n```bash\ncurl -sS 'https://x402-gateway.bankofai.io/providers/dia-price-tron/v1/quotation/{symbol}'\n```\n\n使用 Wallet CLI 在 TRON 主网付费(金额按所选代币数量):\n\n```bash\nwallet-cli x402 pay 'https://x402-gateway.bankofai.io/providers/dia-price-tron/v1/quotation/{symbol}' \\\n  --password-stdin \\\n  --method GET \\\n  --network tron:728126428 \\\n  --token USDT \\\n  --scheme exact \\\n  --max-amount 0.000001\n```\n\nBNB Smart Chain 主网(`eip155:56`,`exact` + `permit2`)示例:\n\n```bash\ncurl -sS 'https://x402-gateway.bankofai.io/providers/dia-price-bsc/v1/quotation/{symbol}'\n```\n\n使用 Wallet CLI 在 BNB Smart Chain 主网付费(金额按所选代币数量):\n\n```bash\nwallet-cli x402 pay 'https://x402-gateway.bankofai.io/providers/dia-price-bsc/v1/quotation/{symbol}' \\\n  --password-stdin \\\n  --method GET \\\n  --network eip155:56 \\\n  --token USDT \\\n  --scheme exact \\\n  --max-amount 0.000001\n```\n\n## Base 主网支付\n\nBase 主网路由使用 `eip155:8453` 官方 USDC，通过 x402 `exact` + EIP-3009 支付。",
      "useCase": "适合需要链上金融、价格、收益、DEX 或安全数据的 Agent 工作流。",
      "mainTitle": "去中心化多源预言机价格"
    }
  },
  "logo": "https://raw.githubusercontent.com/BofAI/x402-catalog/3f08db1d132d864da1d6122a8d279458ce46fe9a/assets/logos/dia.png",
  "category": "finance",
  "chains": [
    "tron:728126428",
    "eip155:56",
    "eip155:8453"
  ],
  "isFirstParty": false,
  "isFeatured": false,
  "featuredTags": [
    "dia",
    "price",
    "oracle",
    "quotation",
    "multi-source",
    "paid"
  ],
  "serviceUrl": "https://www.diadata.org",
  "endpoints": [
    {
      "method": "GET",
      "path": "/v1/quotation/{symbol}",
      "url": "https://x402-gateway.bankofai.io/providers/dia-price-tron/v1/quotation/{symbol}",
      "title": "Aggregated price quotation by asset symbol",
      "subtitle": "/v1/quotation/{symbol}",
      "description": "Aggregated price quotation by asset symbol",
      "useCase": "Use this endpoint when an agent needs aggregated price quotation by asset symbol through the matching TRON, BNB Smart Chain, or Base Mainnet gateway route.",
      "i18n": {
        "zh-CN": {
          "title": "Aggregated price quotation by asset symbol",
          "subtitle": "/v1/quotation/{symbol}",
          "description": "按资产符号聚合的价格报价",
          "useCase": "适合 Agent 在分析、交易、风控或数据查询流程中按需调用。"
        }
      },
      "metered": true,
      "minPriceUsd": 0.000001,
      "maxPriceUsd": 0.000001,
      "x402Routes": [
        {
          "provider": "dia-price-tron",
          "network": "tron:728126428",
          "scheme": "exact",
          "assetTransferMethod": "permit2",
          "url": "https://x402-gateway.bankofai.io/providers/dia-price-tron/v1/quotation/{symbol}"
        },
        {
          "provider": "dia-price-tron",
          "network": "tron:728126428",
          "scheme": "exact_gasfree",
          "url": "https://x402-gateway.bankofai.io/providers/dia-price-tron/v1/quotation/{symbol}"
        },
        {
          "provider": "dia-price-bsc",
          "network": "eip155:56",
          "scheme": "exact",
          "assetTransferMethod": "permit2",
          "url": "https://x402-gateway.bankofai.io/providers/dia-price-bsc/v1/quotation/{symbol}"
        },
        {
          "provider": "dia-price-base",
          "network": "eip155:8453",
          "scheme": "exact",
          "assetTransferMethod": "eip3009",
          "url": "https://x402-gateway.bankofai.io/providers/dia-price-base/v1/quotation/{symbol}"
        }
      ]
    },
    {
      "method": "GET",
      "path": "/v1/assetQuotation/{blockchain}/{address}",
      "url": "https://x402-gateway.bankofai.io/providers/dia-price-tron/v1/assetQuotation/{blockchain}/{address}",
      "title": "Aggregated price quotation by blockchain + contract address",
      "subtitle": "/v1/assetQuotation/{blockchain}/{address}",
      "description": "Aggregated price quotation by blockchain + contract address",
      "useCase": "Use this endpoint when an agent needs aggregated price quotation by blockchain + contract address through the matching TRON, BNB Smart Chain, or Base Mainnet gateway route.",
      "i18n": {
        "zh-CN": {
          "title": "Aggregated price quotation by blockchain + contract address",
          "subtitle": "/v1/assetQuotation/{blockchain}/{address}",
          "description": "按链 + 合约地址聚合的价格报价",
          "useCase": "适合 Agent 在分析、交易、风控或数据查询流程中按需调用。"
        }
      },
      "metered": true,
      "minPriceUsd": 0.000001,
      "maxPriceUsd": 0.000001,
      "x402Routes": [
        {
          "provider": "dia-price-tron",
          "network": "tron:728126428",
          "scheme": "exact",
          "assetTransferMethod": "permit2",
          "url": "https://x402-gateway.bankofai.io/providers/dia-price-tron/v1/assetQuotation/{blockchain}/{address}"
        },
        {
          "provider": "dia-price-tron",
          "network": "tron:728126428",
          "scheme": "exact_gasfree",
          "url": "https://x402-gateway.bankofai.io/providers/dia-price-tron/v1/assetQuotation/{blockchain}/{address}"
        },
        {
          "provider": "dia-price-bsc",
          "network": "eip155:56",
          "scheme": "exact",
          "assetTransferMethod": "permit2",
          "url": "https://x402-gateway.bankofai.io/providers/dia-price-bsc/v1/assetQuotation/{blockchain}/{address}"
        },
        {
          "provider": "dia-price-base",
          "network": "eip155:8453",
          "scheme": "exact",
          "assetTransferMethod": "eip3009",
          "url": "https://x402-gateway.bankofai.io/providers/dia-price-base/v1/assetQuotation/{blockchain}/{address}"
        }
      ]
    }
  ],
  "status": {
    "catalog": "listed",
    "gateway": "configured",
    "payment": "paid-route",
    "upstream": "public"
  }
}
