{
  "version": 1,
  "fqn": "sunpump-token-launch",
  "title": "SunPump",
  "mainTitle": "One-call agent token launch, paid via x402",
  "subtitle": "Create a meme or agent token from structured metadata.",
  "description": "## What it does\n\nSunPump Agent Token Launch API lets agents, scripts, and applications pay with x402 and submit token launch metadata to SunPump. The gateway forwards the caller's JSON payload to the SunPump launch endpoint after payment settlement.\n\n## Best for\n\n- Agent workflows that need to create a meme or agent token from structured metadata.\n- Operator tools that want one paid API call for token creation.\n- Mainnet payment flows across TRON Mainnet, BNB Smart Chain and Base Mainnet while using the same SunPump launch request shape.\n\n## Request shape\n\nPOST a JSON body with `name`, `symbol`, `description`, `imageBase64`, `twitterUrl`, `telegramUrl`, `websiteUrl`, and `tweetUsername`. Keep `name` within 1-20 characters and use a unique symbol. `imageBase64` may include a base64-encoded token image; if it is empty or omitted, SunPump generates an image automatically.\n\n## Code usage\n\nTRON Mainnet defaults to `exact` + `permit2` and also supports `exact_gasfree`. First inspect the payment requirements:\n\n```bash\ncurl -sS -X POST 'https://x402-gateway.bankofai.io/providers/sunpump-token-launch-tron/pump-api/ai/agentTokenLaunch' \\\n  -H 'Content-Type: application/json' \\\n  --data '{\"name\":\"X402MainA\",\"symbol\":\"X4M17\",\"description\":\"x402 launch\",\"imageBase64\":\"\",\"twitterUrl\":\"\",\"telegramUrl\":\"\",\"websiteUrl\":\"\",\"tweetUsername\":\"\"}'\n```\n\nThen pay and submit the launch request with Wallet CLI:\n\n```bash\nwallet-cli x402 pay 'https://x402-gateway.bankofai.io/providers/sunpump-token-launch-tron/pump-api/ai/agentTokenLaunch' \\\n  --password-stdin \\\n  --method POST \\\n  --header 'Content-Type: application/json' \\\n  --body '{\"name\":\"X402MainA\",\"symbol\":\"X4M17\",\"description\":\"x402 launch\",\"imageBase64\":\"\",\"twitterUrl\":\"\",\"telegramUrl\":\"\",\"websiteUrl\":\"\",\"tweetUsername\":\"\"}' \\\n  --network tron:728126428 \\\n  --token USDT \\\n  --scheme exact \\\n  --max-amount 0.000001\n```\n\nBNB Smart Chain Mainnet supports `exact` + `permit2`:\n\n```bash\ncurl -sS -X POST 'https://x402-gateway.bankofai.io/providers/sunpump-token-launch-bsc/pump-api/ai/agentTokenLaunch' \\\n  -H 'Content-Type: application/json' \\\n  --data '{\"name\":\"X402BscA\",\"symbol\":\"X4B17\",\"description\":\"x402 launch\",\"imageBase64\":\"\",\"twitterUrl\":\"\",\"telegramUrl\":\"\",\"websiteUrl\":\"\",\"tweetUsername\":\"\"}'\n```\n\n```bash\nwallet-cli x402 pay 'https://x402-gateway.bankofai.io/providers/sunpump-token-launch-bsc/pump-api/ai/agentTokenLaunch' \\\n  --password-stdin \\\n  --method POST \\\n  --header 'Content-Type: application/json' \\\n  --body '{\"name\":\"X402BscA\",\"symbol\":\"X4B17\",\"description\":\"x402 launch\",\"imageBase64\":\"\",\"twitterUrl\":\"\",\"telegramUrl\":\"\",\"websiteUrl\":\"\",\"tweetUsername\":\"\"}' \\\n  --network eip155:56 \\\n  --token USDT \\\n  --scheme exact \\\n  --max-amount 0.000001\n```\n\n## Base Mainnet payment\n\nBase Mainnet uses official USDC on `eip155:8453` with x402 `exact` and EIP-3009. A successful call still launches the token on TRON Mainnet.",
  "useCase": "Use this provider when an app, agent, or CLI workflow needs to launch a SunPump token after a successful x402 payment. Choose a TRON Mainnet, BNB Smart Chain, or Base Mainnet payment route; every successful launch creates the token on TRON Mainnet.",
  "i18n": {
    "zh-CN": {
      "title": "SunPump",
      "subtitle": "用结构化元数据一次付费发币。",
      "description": "## 能做什么\n\nSunPump Agent 发币 API 允许 Agent、脚本和应用先完成 x402 支付，再把发币元数据提交给 SunPump。Gateway 在支付结算后把调用方的 JSON 请求体转发到 SunPump 发币接口。\n\n## 适合场景\n\n- 需要基于结构化元数据创建 meme token 或 agent token 的 Agent 工作流。\n- 希望用一次付费 API 调用完成发币的运营工具。\n- 在 TRON 主网、BNB Smart Chain 主网和 Base 主网使用同一套 SunPump 发币请求格式。\n\n## 请求格式\n\nPOST JSON 请求体包含 `name`、`symbol`、`description`、`imageBase64`、`twitterUrl`、`telegramUrl`、`websiteUrl` 和 `tweetUsername`。`name` 需要保持在 1-20 个字符内，并使用唯一 symbol。`imageBase64` 可以传入 base64 编码的 token 图片；如果为空或不传，SunPump 会自动生成图片。\n\n## 代码用法\n\nTRON 主网默认使用 `exact` + `permit2`，同时支持 `exact_gasfree`。先查看支付要求：\n\n```bash\ncurl -sS -X POST 'https://x402-gateway.bankofai.io/providers/sunpump-token-launch-tron/pump-api/ai/agentTokenLaunch' \\\n  -H 'Content-Type: application/json' \\\n  --data '{\"name\":\"X402MainA\",\"symbol\":\"X4M17\",\"description\":\"x402 launch\",\"imageBase64\":\"\",\"twitterUrl\":\"\",\"telegramUrl\":\"\",\"websiteUrl\":\"\",\"tweetUsername\":\"\"}'\n```\n\n然后使用 Wallet CLI 支付并提交发币请求：\n\n```bash\nwallet-cli x402 pay 'https://x402-gateway.bankofai.io/providers/sunpump-token-launch-tron/pump-api/ai/agentTokenLaunch' \\\n  --password-stdin \\\n  --method POST \\\n  --header 'Content-Type: application/json' \\\n  --body '{\"name\":\"X402MainA\",\"symbol\":\"X4M17\",\"description\":\"x402 launch\",\"imageBase64\":\"\",\"twitterUrl\":\"\",\"telegramUrl\":\"\",\"websiteUrl\":\"\",\"tweetUsername\":\"\"}' \\\n  --network tron:728126428 \\\n  --token USDT \\\n  --scheme exact \\\n  --max-amount 0.000001\n```\n\nBNB Smart Chain 主网支持 `exact` + `permit2`：\n\n```bash\ncurl -sS -X POST 'https://x402-gateway.bankofai.io/providers/sunpump-token-launch-bsc/pump-api/ai/agentTokenLaunch' \\\n  -H 'Content-Type: application/json' \\\n  --data '{\"name\":\"X402BscA\",\"symbol\":\"X4B17\",\"description\":\"x402 launch\",\"imageBase64\":\"\",\"twitterUrl\":\"\",\"telegramUrl\":\"\",\"websiteUrl\":\"\",\"tweetUsername\":\"\"}'\n```\n\n```bash\nwallet-cli x402 pay 'https://x402-gateway.bankofai.io/providers/sunpump-token-launch-bsc/pump-api/ai/agentTokenLaunch' \\\n  --password-stdin \\\n  --method POST \\\n  --header 'Content-Type: application/json' \\\n  --body '{\"name\":\"X402BscA\",\"symbol\":\"X4B17\",\"description\":\"x402 launch\",\"imageBase64\":\"\",\"twitterUrl\":\"\",\"telegramUrl\":\"\",\"websiteUrl\":\"\",\"tweetUsername\":\"\"}' \\\n  --network eip155:56 \\\n  --token USDT \\\n  --scheme exact \\\n  --max-amount 0.000001\n```\n\n## Base 主网支付\n\nBase 主网路由使用 `eip155:8453` 官方 USDC，通过 x402 `exact` + EIP-3009 支付；成功调用仍会在 TRON 主网创建 Token。",
      "useCase": "适合应用、Agent 或 CLI 流程在 x402 支付成功后调用 SunPump 发币接口。可选择 TRON 主网、BNB Smart Chain 或 Base 主网支付路由；成功后均在 TRON 主网创建 Token。",
      "mainTitle": "一次付费完成 Agent 代币发行"
    }
  },
  "logo": "https://sunpump.meme/favicon.ico",
  "category": "finance",
  "chains": [
    "tron:728126428",
    "eip155:56",
    "eip155:8453"
  ],
  "isFirstParty": true,
  "isFeatured": true,
  "featuredTags": [
    "sunpump",
    "token-launch",
    "agent-token",
    "tron",
    "bsc",
    "base"
  ],
  "serviceUrl": "https://sunpump.meme",
  "endpoints": [
    {
      "method": "POST",
      "path": "/pump-api/ai/agentTokenLaunch",
      "url": "https://x402-gateway.bankofai.io/providers/sunpump-token-launch-tron/pump-api/ai/agentTokenLaunch",
      "x402Routes": [
        {
          "network": "tron:728126428",
          "provider": "sunpump-token-launch-tron",
          "scheme": "exact",
          "assetTransferMethod": "permit2",
          "url": "https://x402-gateway.bankofai.io/providers/sunpump-token-launch-tron/pump-api/ai/agentTokenLaunch"
        },
        {
          "network": "tron:728126428",
          "provider": "sunpump-token-launch-tron",
          "scheme": "exact_gasfree",
          "url": "https://x402-gateway.bankofai.io/providers/sunpump-token-launch-tron/pump-api/ai/agentTokenLaunch"
        },
        {
          "network": "eip155:56",
          "provider": "sunpump-token-launch-bsc",
          "scheme": "exact",
          "assetTransferMethod": "permit2",
          "url": "https://x402-gateway.bankofai.io/providers/sunpump-token-launch-bsc/pump-api/ai/agentTokenLaunch"
        },
        {
          "provider": "sunpump-token-launch-base",
          "network": "eip155:8453",
          "scheme": "exact",
          "assetTransferMethod": "eip3009",
          "url": "https://x402-gateway.bankofai.io/providers/sunpump-token-launch-base/pump-api/ai/agentTokenLaunch"
        }
      ],
      "title": "Launch Agent Token",
      "subtitle": "Create a SunPump token from metadata",
      "description": "Submit token metadata to SunPump after x402 payment settlement. `imageBase64` can carry a base64-encoded token image; when it is empty or omitted, SunPump generates an image automatically. The response includes SunPump status and token data such as token id, owner address, contract address, logo URL, create transaction hash, reserves, and market data when available.",
      "useCase": "Use this endpoint when an agent or backend has already validated launch metadata and is ready to create the token.",
      "i18n": {
        "zh-CN": {
          "title": "Agent 发币",
          "subtitle": "根据元数据创建 SunPump token",
          "description": "在 x402 支付结算后向 SunPump 提交发币元数据。`imageBase64` 可以携带 base64 编码的 token 图片；为空或不传时，SunPump 会自动生成图片。响应包含 SunPump 状态和 token 数据，例如 token id、owner address、contract address、logo URL、create transaction hash、储备和市场数据等。",
          "useCase": "适合 Agent 或后端已经校验好发币元数据，准备正式创建 token 的场景。"
        }
      },
      "metered": true,
      "minPriceUsd": 0.000001,
      "maxPriceUsd": 0.000001
    }
  ],
  "status": {
    "catalog": "listed",
    "gateway": "configured",
    "payment": "mainnet",
    "upstream": "public"
  }
}
